<!ELEMENT books (book+)>
<!ELEMENT book (title?, (isbn+, (zipcode | author)), publish*)>
<!ELEMENT title (#PCDATA)>
<!ELEMENT isbn (#PCDATA)>
<!ELEMENT zipcode (#PCDATA)>
<!ELEMENT author (#PCDATA)>
<!ELEMENT publish (#PCDATA)>

<!ATTLIST title name CDATA #IMPLIED>
<!ATTLIST isbn no CDATA #REQUIRED>
<!ATTLIST zipcode Zname CDATA #FIXED "232232323">
<!ATTLIST publish year CDATA #FIXED "1995">